{
  "schemaVersion": 1,
  "recordId": "illustrative-apple-reference",
  "illustrative": true,
  "source": {
    "sourceId": "illustrative-only",
    "sourceType": "community-measurement",
    "url": "https://example.invalid/apple-reference",
    "revision": null,
    "retrievedAt": "2026-07-22T12:00:00Z",
    "dataUse": "measurement-reference-only"
  },
  "hardware": {
    "machineModelIdentifier": null,
    "chipName": "Illustrative Apple chip",
    "chipVariant": null,
    "gpuCoreCount": null,
    "unifiedMemoryBytes": 25769803776,
    "availableMemoryBytes": null,
    "marketedMemoryBandwidthGBs": 120,
    "osVersion": null
  },
  "runtime": {
    "product": "Illustrative runtime product",
    "productVersion": null,
    "engine": "Illustrative engine",
    "engineBuild": null,
    "backend": "metal",
    "backendVersion": null,
    "artifact": {
      "repository": "example/illustrative-model",
      "revision": null,
      "filename": null,
      "sha256": null,
      "format": "illustrative-format",
      "quantization": "illustrative-4bit"
    },
    "contextTokens": null,
    "kvCache": { "key": null, "value": null, "maximumTokens": null },
    "gpuLayers": null,
    "batchSize": null,
    "microBatchSize": null,
    "threads": null,
    "flashAttention": null,
    "mmap": null,
    "sampler": { "temperature": null, "topP": null, "topK": null, "minP": null, "seed": null },
    "additionalFlags": []
  },
  "protocol": {
    "harnessId": null,
    "promptId": null,
    "promptTokens": 4096,
    "generatedTokens": 128,
    "warmupRuns": null,
    "measuredRuns": 1,
    "seedStrategy": "unknown",
    "powerState": "unknown",
    "thermalState": "unknown",
    "concurrentLoad": "unknown"
  },
  "observations": [
    {
      "metric": "gpu-memory-bandwidth",
      "classification": "assumption",
      "unit": "GB/s-marketed",
      "samples": [],
      "interval": { "lower": 120, "upper": 120 },
      "confidence": null,
      "applicability": "Published chip specification; not observed bandwidth for this run."
    },
    {
      "metric": "generation-throughput",
      "classification": "unknown",
      "unit": "tokens/s",
      "samples": [],
      "interval": null,
      "confidence": null,
      "applicability": "No redistributable, exact-configuration measurement is present in this fixture."
    }
  ],
  "comparisonEligibility": {
    "eligible": false,
    "reasons": ["illustrative-record", "exact-artifact-identity-missing", "runtime-build-missing", "hardware-variant-incomplete"]
  },
  "unknowns": ["available-memory", "chip-variant", "runtime-build", "artifact-revision", "thermal-state"]
}
